{
  "$schema": "https://schema.evideris.com/schemas/recommendation.schema.json",
  "$id": "https://schema.evideris.com/esge/recommendation/emr-colon/r35.v1.0.0.json",
  "lineageId": "rec-emr-cln-r35-essential-features-during-surveillance",
  "type": "recommendation",
  "version": "1.0.0",
  "release": "r2026.07",
  "supersedes": null,
  "supersededBy": null,
  "language": [
    "en"
  ],
  "withinCurriculum": "cur-emr-colon-2023",
  "withinSection": "sec-emr-surveillance",
  "number": 35,
  "title": {
    "en": "Essential features during surveillance colonoscopy"
  },
  "statement": {
    "en": "After endoscopic resection, ESGE recommends the features detailed in the following list should be confirmed and documented during a surveillance colonoscopy."
  },
  "grade": {
    "strength": "strong",
    "evidenceQuality": "high"
  },
  "references": [
    "ref-58",
    "ref-87",
    "ref-145",
    "ref-146",
    "ref-147"
  ],
  "_meta": {
    "provenance": {
      "type": "verbatim",
      "source_doi": "10.1055/a-2077-0497"
    },
    "encodedBy": "other:codex-publisher-dom-import",
    "encodedAt": "2026-08-09"
  },
  "subItems": [
    {
      "label": "i",
      "levelOfAgreement": 95,
      "text": {
        "en": "Assessment of quality of bowel preparation."
      }
    },
    {
      "label": "ii",
      "levelOfAgreement": 96,
      "text": {
        "en": "Completeness of the colonoscopy."
      }
    },
    {
      "label": "iii",
      "levelOfAgreement": 95,
      "text": {
        "en": "Recognition of the EMR scar, extensive imaging (high definition, virtual chromoendoscopy, +/− chromoendoscopy, near-focus/magnification) and photodocumentation [87] [145]."
      },
      "references": [
        "ref-87",
        "ref-145"
      ]
    },
    {
      "label": "iv",
      "levelOfAgreement": 96,
      "text": {
        "en": "Presence of any residual or recurrent adenoma recognized by a transition in pit/vascular pattern (e. g. NICE I to NICE II; Kudo I to Kudo III/IV) ([Fig. 3])."
      }
    },
    {
      "label": "v",
      "levelOfAgreement": 96,
      "text": {
        "en": "The presence of clip artifact [146] [147]. Recognize that clip artifact itself does not need treatment, but, where there is doubt, treatment is safe and prevents unnecessary further procedures for patients."
      },
      "references": [
        "ref-146",
        "ref-147"
      ]
    },
    {
      "label": "vi",
      "levelOfAgreement": 96,
      "text": {
        "en": "Targeted biopsies and endoscopic treatment of any potential residual or recurrent adenoma should be performed."
      }
    },
    {
      "label": "vii",
      "levelOfAgreement": 99,
      "text": {
        "en": "Additional polyps/LNPCPs should be noted and removed if feasible or a plan for their removal made."
      }
    },
    {
      "label": "viii",
      "levelOfAgreement": 93,
      "text": {
        "en": "Need/timing for further surveillance [58]."
      },
      "references": [
        "ref-58"
      ]
    }
  ]
}
