{
  "$schema": "https://schema.evideris.com/schemas/recommendation.schema.json",
  "$id": "https://schema.evideris.com/esge/recommendation/poem-2/r11.v1.0.0.json",
  "lineageId": "rec-poem-2-r11-poem-operators-should-plan-the-procedure-and-aim-to-identify",
  "type": "recommendation",
  "version": "1.0.0",
  "release": "r2026.07",
  "supersedes": null,
  "supersededBy": null,
  "language": [
    "en"
  ],
  "withinCurriculum": "cur-poem-2-2025",
  "withinSection": "sec-poem-2-cleaning-inspection",
  "number": 11,
  "title": {
    "en": "POEM operators should plan the procedure and aim to identify the following anatomical landmarks: the upper esophageal sphincter, the spine, and the gastroesophageal junction."
  },
  "statement": {
    "en": "POEM operators should plan the procedure and aim to identify the following anatomical landmarks: the upper esophageal sphincter, the spine, and the gastroesophageal junction."
  },
  "grade": {
    "strength": "best-practice",
    "evidenceQuality": "no-evidence-available"
  },
  "levelOfAgreement": 83,
  "references": [],
  "_meta": {
    "provenance": {
      "type": "verbatim",
      "source_doi": "10.1055/a-2569-7634"
    },
    "encodedBy": "other:codex-publisher-dom-import",
    "encodedAt": "2026-08-09"
  }
}
