{
  "$schema": "https://schema.evideris.com/schemas/recommendation.schema.json",
  "$id": "https://schema.evideris.com/esge/recommendation/emr-colon/r24.v1.0.0.json",
  "lineageId": "rec-emr-cln-r24-alternative-methods-for-removal",
  "type": "recommendation",
  "version": "1.0.0",
  "release": "r2026.07",
  "supersedes": null,
  "supersededBy": null,
  "language": [
    "en"
  ],
  "withinCurriculum": "cur-emr-colon-2023",
  "withinSection": "sec-emr-during-emr",
  "number": 24,
  "title": {
    "en": "Alternative methods for removal of non-lifting residual adenomatous tissue"
  },
  "statement": {
    "en": "ESGE recommends that, other than snare resection (EMR), the following techniques are alternative methods for removing non-lifting residual adenomatous tissue."
  },
  "grade": {
    "strength": "strong",
    "evidenceQuality": "moderate"
  },
  "references": [
    "ref-9"
  ],
  "_meta": {
    "provenance": {
      "type": "verbatim",
      "source_doi": "10.1055/a-2077-0497"
    },
    "encodedBy": "other:codex-publisher-dom-import",
    "encodedAt": "2026-08-09"
  },
  "subItems": [
    {
      "label": "i",
      "levelOfAgreement": 84,
      "text": {
        "en": "Cold avulsion (using a standard biopsy forceps), then thermal ablation using soft coagulation (ERBE effect 4, 80 W) to the avulsion bed using the snare tip. Non-lifting tissue should be completely removed prior to application of soft coagulation [9]."
      },
      "references": [
        "ref-9"
      ]
    }
  ]
}
