{
  "$schema": "https://schema.evideris.com/schemas/recommendation.schema.json",
  "$id": "https://schema.evideris.com/esge/recommendation/poem-2/r28.v1.0.0.json",
  "lineageId": "rec-poem-2-r28-esge-recommends-that-poem-can-be-performed-on-either-the-ant",
  "type": "recommendation",
  "version": "1.0.0",
  "release": "r2026.07",
  "supersedes": null,
  "supersededBy": null,
  "language": [
    "en"
  ],
  "withinCurriculum": "cur-poem-2-2025",
  "withinSection": "sec-poem-2-myotomy",
  "number": 28,
  "title": {
    "en": "ESGE recommends that POEM can be performed on either the anterior (1–2 o’clock in supine position) or posterior (5–6 o’clock) side."
  },
  "statement": {
    "en": "ESGE recommends that POEM can be performed on either the anterior (1–2 o’clock in supine position) or posterior (5–6 o’clock) side."
  },
  "grade": {
    "strength": "strong",
    "evidenceQuality": "moderate"
  },
  "levelOfAgreement": 91,
  "references": [],
  "_meta": {
    "provenance": {
      "type": "verbatim",
      "source_doi": "10.1055/a-2569-7634"
    },
    "encodedBy": "other:codex-publisher-dom-import",
    "encodedAt": "2026-08-09"
  }
}
