{
  "$schema": "https://schema.evideris.com/schemas/recommendation.schema.json",
  "$id": "https://schema.evideris.com/esge/recommendation/emr-colon/r32.v1.0.0.json",
  "lineageId": "rec-emr-cln-r32-alarm-features-suggesting-adverse",
  "type": "recommendation",
  "version": "1.0.0",
  "release": "r2026.07",
  "supersedes": null,
  "supersededBy": null,
  "language": [
    "en"
  ],
  "withinCurriculum": "cur-emr-colon-2023",
  "withinSection": "sec-emr-after-emr",
  "number": 32,
  "title": {
    "en": "Alarm features suggesting an adverse event post-EMR"
  },
  "statement": {
    "en": "ESGE recommends that the symptoms/signs in the following list be considered alarm features post-EMR suggesting an adverse event relating to the procedure."
  },
  "grade": {
    "strength": "best-practice",
    "evidenceQuality": "low"
  },
  "references": [
    "ref-142",
    "ref-143"
  ],
  "_meta": {
    "provenance": {
      "type": "verbatim",
      "source_doi": "10.1055/a-2077-0497"
    },
    "encodedBy": "other:codex-publisher-dom-import",
    "encodedAt": "2026-08-09"
  },
  "subItems": [
    {
      "label": "i",
      "levelOfAgreement": 97,
      "text": {
        "en": "Persistent abdominal pain despite simple analgesics [142] [143]."
      },
      "references": [
        "ref-142",
        "ref-143"
      ]
    },
    {
      "label": "ii",
      "levelOfAgreement": 96,
      "text": {
        "en": "Persistent abdominal distension associated with abdominal pain."
      }
    },
    {
      "label": "iii",
      "levelOfAgreement": 97,
      "text": {
        "en": "Hemodynamic instability/shock (fever, tachycardia, hypoxia etc.)."
      }
    },
    {
      "label": "iv",
      "levelOfAgreement": 97,
      "text": {
        "en": "Peritonism on clinical examination."
      }
    },
    {
      "label": "v",
      "levelOfAgreement": 97,
      "text": {
        "en": "Persistent large-volume rectal bleeding."
      }
    }
  ]
}
