{
  "$schema": "https://schema.evideris.com/schemas/recommendation.schema.json",
  "$id": "https://schema.evideris.com/esge/recommendation/poem-2/r14.v1.0.0.json",
  "lineageId": "rec-poem-2-r14-esge-suggests-the-use-of-saline-instead-of-colloids-for-subm",
  "type": "recommendation",
  "version": "1.0.0",
  "release": "r2026.07",
  "supersedes": null,
  "supersededBy": null,
  "language": [
    "en"
  ],
  "withinCurriculum": "cur-poem-2-2025",
  "withinSection": "sec-poem-2-mucosal-incision",
  "number": 14,
  "title": {
    "en": "ESGE suggests the use of saline instead of colloids for submucosal tunneling owing to its lower"
  },
  "statement": {
    "en": "ESGE suggests the use of saline instead of colloids for submucosal tunneling owing to its lower cost and because a lasting submucosal injection is not generally needed for POEM."
  },
  "grade": {
    "strength": "weak",
    "evidenceQuality": "very-low"
  },
  "levelOfAgreement": 86,
  "references": [],
  "_meta": {
    "provenance": {
      "type": "verbatim",
      "source_doi": "10.1055/a-2569-7634"
    },
    "encodedBy": "human:david",
    "encodedAt": "2026-07-03",
    "fieldProvenance": {
      "commentary": {
        "type": "verbatim",
        "source_doi": "10.1055/a-2569-7634",
        "source_span": "Paragraph(s) preceding the N RECOMMENDATION block in body; back-to-back groups share commentary."
      }
    }
  },
  "commentary": {
    "en": "esophagram findings, and endoscopy [38]. Therefore, any obstructive esophageal spastic segments should be documented, and their correlation with HRM and imaging test findings assessed. A thorough mucosal inspection both with white-light and image-enhanced endoscopy (narrow-band imaging or image-enhanced endoscopy) is mandatory to rule out pseudoachalasia and neoplastic lesions, especially considering that achalasia patients are at higher risk of squamous cell carcinoma [20]. The scope should be advanced into the stomach to assess the resistance of the gastroesophageal junction (GEJ) and evaluate the gastric cardia. The operator should locate the lesser curvature and then carefully withdraw the scope without altering its orientation to establish clock-face orientation within the esophagus. POEM practitioners should be capable of identifying the anterior and posterior walls in reference to gastric and esophageal landmarks and gravity. The following anatomical landmarks should be meticulously located and documented: the upper esophageal sphincter, the spine, and the GEJ. With the patient in the supine position, operators should also identify the trachea, the left main bronchus, and the aortic arch [39]. It is worth noting that identifying some anatomical landmarks can be challenging in patients with sigmoid-type or end-stage achalasia. The effect of gravity can be used to determine esophageal orientation considering that fluids tend to accumulate at the 6-o\u2019clock position (i. e. the posterior wall for the supine position and the left lateral wall for the left lateral position). As a final recommendation, it is advisable to plan the incision site approximately 2\u20133 cm cranial to the myotomy\u2019s starting point, with a focus on avoiding areas with thick submucosal vessels or severe inflammation.\n\ninjection prior to mucosotomy? There are no comparative studies regarding the use of saline versus colloid, adrenaline versus no adrenaline, or regarding the use, or not, of dye for POEM procedures. Normal saline is widely used for submucosal injection in the context of therapeutic endoscopy. Colloids have an advantage over saline as their cushion remains for longer, with less need for repeated submucosal injections, which is therefore less time-consuming [40]; however, colloids are generally more expensive than saline solutions and a lasting submucosal injection is not generally needed for POEM. During the tunneling, the tip of the endoscope has a stable position, facing toward the submucosal layer, and most knives have the possibility of performing waterjet submucosal injection during the procedure. Adrenaline can be mixed into the submucosal injection in a variety of dilutions and clinical settings, such as for endoscopic mucosal resection or endoscopic submucosal dissection (ESD), in order to decrease intraprocedural bleeding and procedural time [41, 42]. Adrenaline has the disadvantage of increasing the risk of post-procedural pain and cardiovascular events [43]. In the esophagus, serious intraprocedural bleeding during submucosal dissection, either during ESD or in the submucosal tunneling during POEM, is rare [44, 45], and no advantage of using adrenaline has been reported. Dye, namely indigo carmine or methylene blue, is commonly used for better identification of the dissection plane and submucosal vessels [46]. Therefore, it may be used during the mucosal incision and tunneling; although, there is no evidence regarding the efficacy of using dye plus saline versus saline alone with regard to clinical outcomes or AEs."
  }
}
