{
  "$schema": "https://schema.evideris.com/schemas/recommendation.schema.json",
  "$id": "https://schema.evideris.com/esge/recommendation/poem-2/r35.v1.0.0.json",
  "lineageId": "rec-poem-2-r35-esge-recommends-the-use-of-through-the-scope-clips-for-mucos",
  "type": "recommendation",
  "version": "1.0.0",
  "release": "r2026.07",
  "supersedes": null,
  "supersededBy": null,
  "language": [
    "en"
  ],
  "withinCurriculum": "cur-poem-2-2025",
  "withinSection": "sec-poem-2-adverse-events",
  "number": 35,
  "title": {
    "en": "ESGE recommends the use of through-the-scope clips for mucosal closure owing to their high efficacy and availability,"
  },
  "statement": {
    "en": "ESGE recommends the use of through-the-scope clips for mucosal closure owing to their high efficacy and availability, and lower price compared with other closure methods."
  },
  "grade": {
    "strength": "strong",
    "evidenceQuality": "low"
  },
  "levelOfAgreement": 100,
  "references": [],
  "_meta": {
    "provenance": {
      "type": "verbatim",
      "source_doi": "10.1055/a-2569-7634"
    },
    "encodedBy": "human:david",
    "encodedAt": "2026-07-03",
    "fieldProvenance": {
      "commentary": {
        "type": "verbatim",
        "source_doi": "10.1055/a-2569-7634",
        "source_span": "Paragraph(s) preceding the N RECOMMENDATION block in body; back-to-back groups share commentary."
      }
    }
  },
  "commentary": {
    "en": "Furthermore, this suture system is currently more costly and not widely available [90]. A case\u2013control study comparing endoscopic suturing and conventional TTS clips showed that both techniques offered good clinical results, with adequate and safe mucosal closure [91]. As expected, closure time was shorter with clips compared with suturing (16 vs. 33 minutes; P = 0.04). Overall, a cost analysis showed a trend toward lower cost with clips versus endoscopic suturing. The authors suggested that suturing may be most cost-effective for difficult cases where conventional clip closure methods fail. Another study compared TTS clips with OTS clips for POEM and gastric POEM procedures [92]. The authors reported longer clip placement times (6.5 vs. 3.2 minutes; P = 0.01), higher numbers of clips used (5 vs. 1; P = 0.01), and more clip-related AEs (21.7 % vs. 13.0 %; P = 0.01) in the TTS arm compared with the OTS clip arm; however, the quoted AEs (5/36 in the TTS group) included inability to place the clip (n = 2) and clip dislodgement (n = 3). Technical and clinical clip success occurred in 94.5 % versus 91.7 % of cases (P = 0.13), and 91.7 % vs. 100 % (P = 0.01) for TTS clips and OTS clips, respectively. 9.1 How to prevent and manage bleeding during submucosal tunneling and when performing the myotomy"
  }
}
