{
  "$schema": "https://schema.evideris.com/schemas/recommendation.schema.json",
  "$id": "https://schema.evideris.com/esge/recommendation/emr-colon/r4.v1.0.0.json",
  "lineageId": "rec-emr-cln-r4-features-prompting-consideration-bloc",
  "type": "recommendation",
  "version": "1.0.0",
  "release": "r2026.07",
  "supersedes": null,
  "supersededBy": null,
  "language": [
    "en"
  ],
  "withinCurriculum": "cur-emr-colon-2023",
  "withinSection": "sec-emr-knowledge",
  "number": 4,
  "title": {
    "en": "Features prompting consideration of en bloc resection or surgery"
  },
  "statement": {
    "en": "ESGE recommends the endoscopic features of an LNPCP detailed in the following list should prompt consideration of en bloc resection or surgery rather than a piecemeal approach with EMR ([Table 1])."
  },
  "grade": {
    "strength": "strong",
    "evidenceQuality": "moderate"
  },
  "references": [
    "ref-28",
    "ref-33",
    "ref-34",
    "ref-35",
    "ref-36"
  ],
  "_meta": {
    "provenance": {
      "type": "verbatim",
      "source_doi": "10.1055/a-2077-0497"
    },
    "encodedBy": "other:codex-publisher-dom-import",
    "encodedAt": "2026-08-09"
  },
  "subItems": [
    {
      "label": "i",
      "levelOfAgreement": 93,
      "text": {
        "en": "Endoscopic imaging features suggesting low risk superficial SMI (en bloc endoscopic resection) or deep SMI (surgery) [28]."
      },
      "references": [
        "ref-28"
      ]
    },
    {
      "label": "ii",
      "levelOfAgreement": 85,
      "text": {
        "en": "Any bulky (Is, IIa+Is with nodule >10 mm) lesion in the rectum or at the rectosigmoid junction (high risk for covert SMI) without endoscopic imaging features suggesting overt SMI (en bloc endoscopic resection) [33]."
      },
      "references": [
        "ref-33"
      ]
    },
    {
      "label": "iii",
      "levelOfAgreement": 88,
      "text": {
        "en": "Any LNPCP with Kudo Vi/JNET 2B pit/vascular pattern where en bloc resection is not possible with EMR (en bloc endoscopic resection)."
      }
    },
    {
      "label": "iv",
      "levelOfAgreement": 92,
      "text": {
        "en": "Any LNPCP with Kudo Vn/JNET 3/NICE III pit/vascular pattern (surgery)."
      }
    },
    {
      "label": "v",
      "levelOfAgreement": 91,
      "text": {
        "en": "Any LNPCP with Paris 0-IIa+c or 0-III morphology and ulceration (surgery)."
      }
    },
    {
      "label": "vi",
      "levelOfAgreement": 84,
      "text": {
        "en": "Periappendiceal LNPCPs invading deeply into the appendiceal orifice (defined by the inability to visualize the entire circumferential margin of the lesion) without prior appendicectomy (full-thickness resection/surgery) [34]."
      },
      "references": [
        "ref-34"
      ]
    },
    {
      "label": "vii",
      "levelOfAgreement": 84,
      "text": {
        "en": "Inadequate endoscopic access to the target lesion for EMR even by an expert in the technique [35] (laparoscopically assisted EMR or surgery) [36]."
      },
      "references": [
        "ref-35",
        "ref-36"
      ]
    }
  ]
}
