{
  "$schema": "https://schema.evideris.com/schemas/recommendation.schema.json",
  "$id": "https://schema.evideris.com/esge/recommendation/poem-2/r41.v1.0.0.json",
  "lineageId": "rec-poem-2-r41-esge-recommends-performing-poem-using-low-flow-co2-insufflat",
  "type": "recommendation",
  "version": "1.0.0",
  "release": "r2026.07",
  "supersedes": null,
  "supersededBy": null,
  "language": [
    "en"
  ],
  "withinCurriculum": "cur-poem-2-2025",
  "withinSection": "sec-poem-2-adverse-events",
  "number": 41,
  "title": {
    "en": "ESGE recommends performing POEM using low flow CO2 insufflation."
  },
  "statement": {
    "en": "ESGE recommends performing POEM using low flow CO2 insufflation."
  },
  "grade": {
    "strength": "strong",
    "evidenceQuality": "low"
  },
  "levelOfAgreement": 94,
  "references": [],
  "_meta": {
    "provenance": {
      "type": "verbatim",
      "source_doi": "10.1055/a-2569-7634"
    },
    "encodedBy": "other:codex-publisher-dom-import",
    "encodedAt": "2026-08-09"
  }
}
