{
  "$schema": "https://schema.evideris.com/schemas/recommendation.schema.json",
  "$id": "https://schema.evideris.com/esge/recommendation/esd/r16.v1.0.0.json",
  "lineageId": "rec-esd-r16-minimum-case-load-25-esd-procedures-per-year",
  "type": "recommendation",
  "version": "1.0.0",
  "release": "r2026.07",
  "supersedes": null,
  "supersededBy": null,
  "language": [
    "en"
  ],
  "withinCurriculum": "cur-esd-2019",
  "withinSection": "sec-esd-knowledge-competence",
  "number": 16,
  "title": {
    "en": "In order to maintain proficiency in ESD, ESGE recommends a minimum case load of 25 ESD procedures per year."
  },
  "statement": {
    "en": "In order to maintain proficiency in ESD, ESGE recommends a minimum case load of 25 ESD procedures per year."
  },
  "levelOfAgreement": 100,
  "references": [],
  "_meta": {
    "provenance": {
      "type": "verbatim",
      "source_doi": "10.1055/a-0996-0912"
    },
    "encodedBy": "other:codex-publisher-dom-import",
    "encodedAt": "2026-08-09"
  }
}
