{
  "$schema": "https://schema.evideris.com/schemas/recommendation.schema.json",
  "$id": "https://schema.evideris.com/esge/recommendation/emr-colon/r26.v1.0.0.json",
  "lineageId": "rec-emr-cln-r26-strategies-for-difficult-access",
  "type": "recommendation",
  "version": "1.0.0",
  "release": "r2026.07",
  "supersedes": null,
  "supersededBy": null,
  "language": [
    "en"
  ],
  "withinCurriculum": "cur-emr-colon-2023",
  "withinSection": "sec-emr-during-emr",
  "number": 26,
  "title": {
    "en": "Strategies for difficult to access LNPCPS"
  },
  "statement": {
    "en": "ESGE recommends that the strategies detailed below could be employed to facilitate access to the target LNPCP where this is difficult."
  },
  "grade": {
    "strength": "moderately-strong",
    "evidenceQuality": "low"
  },
  "references": [
    "ref-10"
  ],
  "_meta": {
    "provenance": {
      "type": "verbatim",
      "source_doi": "10.1055/a-2077-0497"
    },
    "encodedBy": "other:codex-publisher-dom-import",
    "encodedAt": "2026-08-09"
  },
  "subItems": [
    {
      "label": "i",
      "levelOfAgreement": 96,
      "text": {
        "en": "Change patient position to respect the influence of gravity on fluid/blood (away from the lesion) and to optimize views."
      }
    },
    {
      "label": "ii",
      "levelOfAgreement": 94,
      "text": {
        "en": "Optimize patient sedation."
      }
    },
    {
      "label": "iii",
      "levelOfAgreement": 93,
      "text": {
        "en": "Administration of antispasmodics."
      }
    },
    {
      "label": "iv",
      "levelOfAgreement": 96,
      "text": {
        "en": "Excellent basic colonoscopy technique to arrive at the lesion without looping."
      }
    },
    {
      "label": "v",
      "levelOfAgreement": 86,
      "text": {
        "en": "Use of external pressure to prevent loop formation during insertion."
      }
    },
    {
      "label": "vi",
      "levelOfAgreement": 93,
      "text": {
        "en": "Use of different endoscopes with different lengths, stiffness, and tip-bending properties etc. (e. g. pediatric colonoscope, gastroscope, balloon-enteroscope)."
      }
    },
    {
      "label": "vii",
      "levelOfAgreement": 90,
      "text": {
        "en": "Ask assistant/nurse to hold the endoscope as needed."
      }
    },
    {
      "label": "viii",
      "levelOfAgreement": 94,
      "text": {
        "en": "Position the lesion at 5–6 o’clock."
      }
    },
    {
      "label": "ix",
      "levelOfAgreement": 91,
      "text": {
        "en": "Use retroflexion where possible and appropriate."
      }
    },
    {
      "label": "x",
      "levelOfAgreement": 94,
      "text": {
        "en": "Use luminal insufflation and desufflation."
      }
    },
    {
      "label": "xi",
      "levelOfAgreement": 91,
      "text": {
        "en": "Use of a transparent distal attachment (e. g. for flexures, ileocecal valve, or dentate line)."
      }
    },
    {
      "label": "xii",
      "levelOfAgreement": 85,
      "text": {
        "en": "Resection technique: commence resection in a way that facilitates access to the most difficult part of the lesion early in the procedure to optimize the chance of complete resection."
      }
    },
    {
      "label": "xiii",
      "levelOfAgreement": 94,
      "text": {
        "en": "Resection technique: use submucosal lifting to promote access to the required part of the lesion."
      }
    },
    {
      "label": "xiv",
      "levelOfAgreement": 92,
      "text": {
        "en": "Resection technique: use snare resection of the surrounding lifting mucosa to create a step for snare placement on difficult-to-capture tissue."
      }
    },
    {
      "label": "xv",
      "levelOfAgreement": 85,
      "text": {
        "en": "Resection technique: create a step into the submucosal plane to assist snare placement (hybrid-EMR)."
      }
    },
    {
      "label": "xvi",
      "levelOfAgreement": 85,
      "text": {
        "en": "Resection technique: use an avulsion technique such as cold avulsion."
      }
    },
    {
      "label": "xvii",
      "levelOfAgreement": 95,
      "text": {
        "en": "Consider asking for a second opinion from a more experienced colleague at the time or before a second attempt. Consider that you may not be the best person to perform the second attempt."
      }
    },
    {
      "label": "xviii",
      "levelOfAgreement": 85,
      "text": {
        "en": "Try a second attempt at EMR prior to surgery (two-stage EMR) [10]."
      },
      "references": [
        "ref-10"
      ]
    }
  ]
}
