{
  "$schema": "https://schema.evideris.com/schemas/recommendation.schema.json",
  "$id": "https://schema.evideris.com/esge/recommendation/poem-2/r6.v1.0.0.json",
  "lineageId": "rec-poem-2-r6-esge-recommends-managing-antithrombotic-therapy-by-assessing",
  "type": "recommendation",
  "version": "1.0.0",
  "release": "r2026.07",
  "supersedes": null,
  "supersededBy": null,
  "language": [
    "en"
  ],
  "withinCurriculum": "cur-poem-2-2025",
  "withinSection": "sec-poem-2-preparation",
  "number": 6,
  "title": {
    "en": "ESGE recommends managing antithrombotic therapy by assessing the patient\u2019s thrombotic risk and"
  },
  "statement": {
    "en": "ESGE recommends managing antithrombotic therapy by assessing the patient\u2019s thrombotic risk and recognizing POEM as a procedure with a high risk of bleeding."
  },
  "grade": {
    "strength": "strong",
    "evidenceQuality": "low"
  },
  "levelOfAgreement": 97,
  "references": [],
  "_meta": {
    "provenance": {
      "type": "verbatim",
      "source_doi": "10.1055/a-2569-7634"
    },
    "encodedBy": "human:david",
    "encodedAt": "2026-07-03",
    "fieldProvenance": {
      "commentary": {
        "type": "verbatim",
        "source_doi": "10.1055/a-2569-7634",
        "source_span": "Paragraph(s) preceding the N RECOMMENDATION block in body; back-to-back groups share commentary."
      }
    }
  },
  "commentary": {
    "en": "Different approaches have been shown to improve esophageal cleansing, such as the induction of emesis by the fast drinking of carbonated beverages, or drinking warm water (60 \u00b0C) in the evening before the procedure [19]. Inoue et al. recommended an endoscopic examination prior to POEM to evaluate the amount of retained residues in order to decide the fasting period, which should be a \u201cfew days,\u201d especially for patients with sigmoid esophagus [20]. A previous gastroscopy to clean the esophagus may be useful [21]; however, this approach increases the burden of care and may not be necessary if patients are kept on a clear liquid diet for 48 hours before POEM, or for 3\u20135 days for those who have had large amounts of food retention in previous endoscopies [22, 23]. Pa\u0002ent ID: Date: Material High-de\ufb01ni\u0002on endoscope with waterjet irriga\u0002on Electrosurgical unit CO2 insu\ufb04ator +/\u2212 low/ultralow \ufb02ow tube Submucosal injec\u0002on solu\u0002on Saline Chromic dye Saline or sterile water Transparent distal cap a\u0004achment* Injec\u0002on needle (23\u201325G) Electrosurgical knife Coagula\u0002on forceps Rotatable hemoclips Other closure devices** Capnoperitoneum decompression Veress needle /16\u201318G intravenous catheter Sterile gauzes Sterile gloves Saline An\u0002sep\u0002c solu\u0002on Syringe Sterile fenestrated drape Signature: \u25b6Fig. 1 The ESGE suggested peroral endoscopic myotomy (POEM) equipment checklist."
  }
}
